{
  "$schema": "https://json-schema.org/draft-07/schema",
  "$id": "https://raw.githubusercontent.com/Dworf/statusline-bar/main/schema.json",
  "title": "statusline-bar config",
  "type": "object",
  "properties": {
    "$schema": { "type": "string" },
    "version": { "const": 1 },
    "preset": {
      "anyOf": [
        { "type": "null" },
        { "enum": ["minimum","compact","focus","coder","default","modern","rates","cache","claude","fancy","everything","maximum"] }
      ]
    },
    "theme": {
      "enum": ["default","solarized","graphite","light","solarized-light","catppuccin-latte","tokyo-day","ayu-light","garden","dark","dracula","nord","gruvbox","tokyo-night","catppuccin","one-dark","rose-pine","monokai","mocha","silver","ocean"]
    },
    "global": {
      "type": "object",
      "properties": {
        "prefix_style": { "enum": ["none","label","emoji","nerd","ascii","emoji+label","label+emoji","nerd+label"] },
        "separator":    { "enum": ["space","pipe","slash","dot","vbar","dash","bullet","diamond","arrow","tri","star","sparkle","gear","check","heart","music","chevron","slant","chevron_thin"] },
        "bar_style":    { "anyOf": [{ "type": "null" }, { "enum": ["blocks","heavy","line","braille","dots","arrows","ascii","gradient","gradient_dots","gradient_fade","gradient_shade","gradient_braille"] }] },
        "color_depth":  { "enum": ["auto","truecolor","256","16","none"] },
        "empty_behavior": { "enum": ["hide","placeholder"] },
        "placeholder":  { "type": "string" },
        "bar_width":    { "type": "integer", "minimum": 1, "maximum": 40 }
      },
      "additionalProperties": false
    },
    "lines": {
      "type": "array",
      "minItems": 1,
      "maxItems": 4,
      "items": {
        "type": "array",
        "items": { "type": "string" }
      }
    },
    "tokens": {
      "type": "object",
      "patternProperties": {
        "^[a-z0-9_]+$": {
          "type": "object",
          "properties": {
            "prefix":    { "enum": ["none","label","emoji","nerd","ascii","emoji+label","label+emoji","nerd+label"] },
            "format":    { "enum": ["value","compact","short","id","id_short","percent","progressbar","progressbar+percent","tokens","tokens+size","percent+tokens","progressbar+percent+tokens","flag","countdown","countdown_short","remaining","remaining_short","cause","count+cause","per_hour","with_rate","count","progressbar+percent+countdown","progressbar+percent+countdown_short","progressbar+percent+remaining","progressbar+percent+remaining_short","combined"] },
            "bar_style": { "enum": ["blocks","heavy","line","braille","dots","arrows","ascii","gradient","gradient_dots","gradient_fade","gradient_shade","gradient_braille"] },
            "separator_after": { "enum": ["space","pipe","slash","dot","vbar","dash","bullet","diamond","arrow","tri","star","sparkle","gear","check","heart","music","chevron","slant","chevron_thin"] }
          },
          "additionalProperties": false
        }
      }
    },
    "_cache": {
      "type": "object",
      "properties": {
        "nerd_font_available": { "type": ["boolean","null"] },
        "detected_at": { "type": "integer" }
      }
    }
  },
  "required": ["version","theme","global","lines"],
  "additionalProperties": false
}
