{
  "version": 1,
  "preset": "default",
  "theme": "default",
  "global": {
    "prefix_style": "emoji",
    "separator": "pipe",
    "bar_style": null,
    "color_depth": "none",
    "empty_behavior": "placeholder",
    "placeholder": "—",
    "bar_width": 10
  },
  "lines": [["cache_warm"]],
  "tokens": {}
}
